Product ID;Active (0/1);Name *;Categories (x,y,z...);Price tax excluded;Tax rules ID;Wholesale price;On sale (0/1);Discount amount;Discount percent;Discount from (yyyy-mm-dd);Discount to (yyyy-mm-dd);Reference #;Supplier reference #;Supplier;Manufacturer;EAN13;UPC;Ecotax;Width;Height;Depth;Weight;Delivery time of in-stock products;Delivery time of out-of-stock products with allowed orders;Quantity;Minimal quantity;Low stock level;Send me an email;Visibility;Additional shipping cost;Unity;Unit price;Summary;Description;Tags (x,y,z...);Meta title;Meta keywords;Meta description;URL rewritten;Text when in stock;Text when backorder allowed;Available for order (0 = No, 1 = Yes);Product available date;Product creation date;Show price (0 = No, 1 = Yes);Image URLs (x,y,z...);Image alt texts (x,y,z...);Delete existing images(0 = No, 1 = Yes);Feature(Name: Value: Position);Available online only(0 = No, 1 = Yes);Condition;Customizable(0 = No, 1 = Yes);Uploadable files (0 = No, 1 = Yes);Text fields (0 = No, 1 = Yes);Out of stock action;Virtual product;File URL;Number of allowed downloads;Expiration date;Number of days;ID / Name of shop;Advanced stock management;Depends On Stock;Warehouse;Acessories(x, y, z...)
1;1;Naprzód (DVD);1003,1001,1000;32.51;1;23.79;1;;;;;demo_1;demo_1;;;;;;;;;;;;;1;;0;both;;;;Film;Najnowsza produkcja ze studia Disney Pixar.;;;;;naprzod-dvd;Produkt dostępny;Zamówienie dozwolone;1;;;1;;;1;Producent:Galapagos:0,Reżyseria:  Scanlon Dan   :3,Czas trwania [min]:98 :7,Kraj Produkcji:USA :8,Rok Produkcji:2020 :9,;0;new;1;;;;;;;;;;;;;
2;1;Kraina lodu 2 (DVD);1003,1001,1000;32.51;1;23.79;1;;;;;demo_2;demo_2;;;;;;;;;;;;;1;;0;both;;;;Film;Wielokrotnie nagradzani twórcy światowego fenomenu powracają z filmem! W „Krainie lodu II” znanym postaciom towarzyszy zupełnie nowa muzyka. Elsa, Anna, Kristoff, Olaf i Sven wyruszają z Arendelle do Zaklętej Puszczy oraz za Mroczne Morze. Czy Elsie uda się poznać prawdę o jej przeszłości oraz odkryć co zagraża królestwu?;;;;;kraina-lodu-2-dvd;Produkt dostępny;Zamówienie dozwolone;1;;;1;;;1;Producent:Galapagos:0,Reżyseria:  Buck Chris  Lee Jennifer  :3,Czas trwania [min]:99 :7,Kraj Produkcji:USA :8,Rok Produkcji:2019 :9,;0;new;1;;;;;;;;;;;;;
3;1;Czarownica 2 (DVD);1003,1001,1000;32.51;1;23.79;1;;;;;demo_3;demo_3;;;;;;;;;;;;;1;;0;both;;;;Film;„Czarownica 2” z Angeliną Jolie w roli głównej to dalszy ciąg historii najsłynniejszego czarnego charakteru Disneya. Po wielu wspólnych szczęśliwych latach relacja Diaboliny i jej córki chrzestnej Aurory zostaje wystawiona na ciężką próbę. Przyczyną jest zbliżający się ślub Aurory. W życiu bohaterek pojawiają się nieoczekiwani sojusznicy i nowe, mroczne siły. Ich miłość okazuje się jednak mocniejsza, dzięki czemu żyją długo i szczęśliwie.;;;;;czarownica-2-dvd;Produkt dostępny;Zamówienie dozwolone;1;;;1;;;1;Producent:Galapagos:0,Reżyseria:  Joachim Rønning  :3,Czas trwania [min]:113 :7,Kraj Produkcji:USA :8,Rok Produkcji:2019 :9,;0;new;1;;;;;;;;;;;;;
4;1;Paskudy. UglyDolls (DVD) + Książka;1003,1001,1000;8.12;1;5.94;1;;;;;demo_4;demo_4;;;;;;;;;;;;;1;;0;both;;;;Film;Niech żyją wyjątkowi, niezwykli, jedyni w swoim rodzaju! Poznajcie Paskudy – bohaterów nowej komedii dla całej rodziny, która udowadnia, że nie musisz być pięknym, żeby być wspaniałym!Paskudy są miłe, bystre i życzliwe, ale nietypowa uroda wyklucza je ze świata pięknych lalek, które mają nieść radość dzieciom. Pogodzone z losem wiodą spokojny żywot w położonym na uboczu Paskudowie. Dla małej zadziornej Moxy to jednak za mało. Ona pragnie poznać świat i zrozumieć, dlaczego Paskudy nie mogą trafiać do rąk dzieciaków. Razem z grupą przyjaciół przedostaje się do skostniałego, pełnego reguł miasta lalek idealnych. Wszystko tu jest eleganckie, symetryczne, ale zimne i pozbawione uroku. Czy poczucie humoru i niespożyta energia Moxy może to zmienić i udowodnić, że nie trzeba być idealnym by być wspaniałym?! Czy Paskudy mają szansę spełnić swoje marzenie, by nieść radość dzieciom? No raczej, bo przecież Paskudne jest cudne!;;;;;paskudy-uglydolls-dvd-ksiazka;Produkt dostępny;Zamówienie dozwolone;1;;;1;;;1;Producent:Dasan:0,Reżyseria:  Kelly Asbury   :3,Czas trwania [min]:84 :7,Kraj Produkcji:Chiny:8,Rok Produkcji:2019 :9,;0;new;1;;;;;;;;;;;;;
5;1;Western stars (DVD);1004,1001,1000;32.51;1;23.79;1;;;;;demo_5;demo_5;;;;;;;;;;;;;1;;0;both;;;;Film;Bruce Springsteen przenosi na ekran swój najnowszy studyjny album Western Stars, wykonując każdą z trzynastu piosenek z zespołem i orkiestrą w swojej prawie stuletniej stodole. Western Stars to debiut reżyserski Springsteena. W realizacji filmu brał udział jego stały współpracownik Thom Zimny, dzięki temu poznajemy życie i twórczość tego wielkiego amerykańskiego artysty z zupełnie innej strony. Film łączy materiały dokumentalne z koncertów, wspomnienia Springsteena i jego prywatne nagrania z zapierającymi dech w piersiach widokami amerykańskiego Zachodu. Jednym słowem – to opowieść o miłości i stracie, odosobnieniu, rodzinie i wiecznym poszukiwaniu bezkresnej przestrzeni.;;;;;western-stars-dvd;Produkt dostępny;Zamówienie dozwolone;1;;;1;;;1;Producent:Galapagos:0,Reżyseria:  Bruce Springsteen  :3,Czas trwania [min]:80 :7,Kraj Produkcji:USA :8,Rok Produkcji:2019 :9,;0;new;1;;;;;;;;;;;;;
6;1;Mr. Gaga (DVD);1004,1001,1000;16.25;1;11.89;1;;;;;demo_6;demo_6;;;;;;;;;;;;;1;;0;both;;;;Film;„Mr. Gaga” opowiada o Ohadzie Naharinie, genialnym choreografie i prowadzonej przez niego Batsheva Dance Company. Reżyser Tomer Heymann przez 8 lat rejestrował spektakle i życie człowieka, który zrewolucjonizował język tańca. Naharin opracował język ruchu – GAGA, pozwalający zrozumieć związek ruchu i ciała z naszymi emocjami. W połączeniu z niepokazywanym dotychczas materiałem archiwalnym oraz fragmentami tanecznych spektakli Batshevy dostajemy fascynującą historię człowieka, który stał się ikoną tańca współczesnego.;;;;;mr-gaga-dvd;Produkt dostępny;Zamówienie dozwolone;1;;;1;;;1;Producent:Add Media:0,Reżyseria:  Tomer Heymann  :3,Czas trwania [min]:99 :7,Kraj Produkcji:Holandia:8,Rok Produkcji:2015 :9,;0;new;1;;;;;;;;;;;;;
7;1;Nasze miejsce na Ziemi (DVD);1004,1001,1000;21.94;1;16.05;1;;;;;demo_7;demo_7;;;;;;;;;;;;;1;;0;both;;;;Film;Obsypany nagrodami na kilkunastu festiwalach filmowych niezwykły film dokumentalny, który ogląda się jak najlepszą fabułę. Realizowany przez osiem lat hołd złożony niezwykłemu bogactwu otaczającej nas przyrody, którą musimy nauczyć się rozumieć zanim będzie za późno. Nieocenione źródło wiedzy o świecie, który okazuje się znacznie bardziej niezwykły, niż nam się wydaje.Znakomity reżyser John Chester wraz z żoną Molly muszą opuścić swoje małe mieszkanko w Los Angeles. Wszystko za sprawą ukochanego psa Todda, którego szczekanie drażni sąsiadów. Chesterowie traktują swoje wygnanie jako pretekst do realizacji marzenia o własnej farmie, funkcjonującej w zgodzie z prawami natury. 80 hektarów ziemi w upalnej Kalifornii staje się odtąd ich nowym domem. Z pomocą przyjaciół i zapaleńców z całego świata, Jack i Molly realizują wyjątkowy projekt: 10 tysięcy drzew, ponad 200 rodzajów upraw i dziesiątki gatunków zwierząt żyjących w zgodzie ze sobą i swoją naturą, a wszystko to bez udziału szkodliwej chemii i bezdusznej technologii.;;;;;nasze-miejsce-na-ziemi-dvd;Produkt dostępny;Zamówienie dozwolone;1;;;1;;;1;Producent:Dasan:0,Reżyseria:  John Chester  :3,Czas trwania [min]:88 :7,Kraj Produkcji:USA :8,Rok Produkcji:2018 :9,;0;new;1;;;;;;;;;;;;;
8;1;Amy;1004,1001,1000;16.25;1;11.89;1;;;;;demo_8;demo_8;;;;;;;;;;;;;1;;0;both;;;;Film;"Nieznana, prawdziwa historia wielkiej gwiazdy – błyskotliwej dziewczyny, obdarzonej wyjątkowym talentem, która w rekordowo krótkim czasie osiągnęła szczyty sławy. Przejmująca opowieść o inteligentnej i skomplikowanej kobiecie, która chciała tylko, aby ją kochano. Kim była naprawdę Amy Winehouse, która z dnia na dzień stała się ikoną światowej muzyki? Jak odmieniło ją spotkanie z mężczyzną, którego obdarzyła uczuciem silniejszym niż narkotyk? Co ukrywała przed światem? Dlaczego zginęła w tajemniczych okolicznościach w wieku zaledwie 27 lat? „Amy” to trzymająca w napięciu historia, stworzona z nieznanych dotąd materiałów, kręconych ukradkiem ujęć, zbliżeń i wyznań. Przejmujący film, który ukazuje prawdziwą historię, znaną tylko z plotkarskich portali i pierwszych stron gazet. Amy Winehouse – z dala od kamer, prywatnie, intymnie, a także na scenie w świetle reflektorów. Jej talent, miłość i tajemnica w filmowym wydarzeniu, które zachwyciło i wzruszyło światową widownię.
";;;;;amy;Produkt dostępny;Zamówienie dozwolone;1;;;1;;;1;Producent:Add Media:0,Reżyseria:  Kapadia Asif   :3,Czas trwania [min]:127 :5,Kraj Produkcji:Wielka Brytania :6,Rok Produkcji:2015 :7,;0;new;1;;;;;;;;;;;;;
9;1;Tylko sprawiedliwość (DVD);1005,1001,1000;32.51;1;23.79;1;;;;;demo_9;demo_9;;;;;;;;;;;;;1;;0;both;;;;Film;Przejmująca historia absolwenta Harvardu Bryna Stevensona, który odrzuca lukratywne propozycje pracy, by w Alabamie bronić niesłusznie oskarżonych. Wspierany przez miejscową adwokat podejmuje się głośnej sprawy McMilliana skazanego na śmierć za morderstwo. W obliczu jawnego rasizmu i politycznych gierek Bryan broni Waltera i innych skazańców.;;;;;tylko-sprawiedliwosc-dvd;Produkt dostępny;Zamówienie dozwolone;1;;;1;;;1;Producent:Galapagos:0,Reżyseria:  Destin Daniel Cretton  :3,Czas trwania [min]:132 :7,Kraj Produkcji:USA :8,Rok Produkcji:2019 :9,;0;new;1;;;;;;;;;;;;;
10;1;Big Love;1005,1001,1000;4.06;1;2.97;1;;;;;demo_10;demo_10;;;;;;;;;;;;;1;;0;both;;;;Film;"Big Love to polski film fabularny z 2012 roku w reżyserii Barbary Białowąs. W rolach głównych wystąpili Aleksandra Hamkało oraz Antoni Pawlicki.
";;;;;big-love-1;Produkt dostępny;Zamówienie dozwolone;1;;;1;;;1;Producent:Monolith:0,Reżyseria:  Białowąs Barbara   :3,Czas trwania [min]:96 :7,Kraj Produkcji:Polska :8,Rok Produkcji:2012 :9,;0;new;1;;;;;;;;;;;;;
11;1;Droga powrotna (DVD);1005,1001,1000;32.51;1;23.79;1;;;;;demo_11;demo_11;;;;;;;;;;;;;1;;0;both;;;;Film;Jack Cunningham (Ben Affleck) był w liceum gwiazdą koszykówki, rysowała się przed nim obiecująca przyszłość. Niespodziewanie porzucił sport. Po latach zmaga się z alkoholizmem, zapłacił już małżeństwem i nadzieją na lepsze życie. Propozycja objęcia funkcji trenera koszykówki w jego dawnej szkole jest pretekstem do stawienia czoła rozterkom duszy. Czy to wystarczy, żeby zabliźniły się głębokie rany z przeszłości? Czy Jack wreszcie przejdzie wewnętrzną przemianę?;;;;;droga-powrotna-dvd;Produkt dostępny;Zamówienie dozwolone;1;;;1;;;1;Producent:Galapagos:0,Reżyseria:  Gavin O'Connor  :3,Czas trwania [min]:104 :7,Kraj Produkcji:USA :8,Rok Produkcji:2020 :9,;0;new;1;;;;;;;;;;;;;
12;1;Ugotowany (booklet DVD);1005,1001,1000;4.06;1;2.97;1;;;;;demo_12;demo_12;;;;;;;;;;;;;1;;0;both;;;;Film;"Adam Jones (Bradley Cooper) to charyzmatyczny szef kuchni, który szybko zyskał rozgłos jako guru paryskich restauratorów. Podążał własną ścieżką i tworzył intrygujące połączenia smaków. Nie udźwignął jednak ciężaru sławy, zniknął z pierwszych stron gazet i rozpłynął się w powietrzu. Teraz, wolny od wszelkich uzależnień, próbuje swoich sił w sercu kulinarnego Londynu. Gromadzi doborową załogę, by stworzyć najlepszą restaurację na świecie. Czy, kierując grupą utalentowanych ekscentryków, zdoła wspiąć się na kulinarny Olimp? Czy uczucie do pięknej Helene (Sienna Miller) nie przeszkodzi mu w zdobyciu upragnionej, trzeciej gwiazdki Michelin?
";;;;;ugotowany-booklet-dvd;Produkt dostępny;Zamówienie dozwolone;1;;;1;;;1;Producent:Monolith:0,Reżyseria:  Wells John   :3,Czas trwania [min]:96 :6,Kraj Produkcji:USA :7,Rok Produkcji:2015 :8,;0;new;1;;;;;;;;;;;;;
13;1;Gwiezdne Wojny: Skywalker. Odrodzenie (DVD);1006,1001,1000;28.45;1;20.82;1;;;;;demo_13;demo_13;;;;;;;;;;;;;1;;0;both;;;;Film;Lucasfilm i reżyser J.J. Abrams ponownie łączą siły, aby zabrać widzów w spektakularną podróż do odległej galaktyki. Film „Gwiezdne wojny: Skywalker. Odrodzenie” to fascynujące zakończenie sagi Skywalkerów – narodzą się nowe legendy i ostatecznie zostanie rozstrzygnięta bitwa o wolność.;;;;;gwiezdne-wojny-skywalker-odrodzenie-dvd;Produkt dostępny;Zamówienie dozwolone;1;;;1;;;1;Producent:Galapagos:0,Reżyseria:  Abrams Jeffrey Jacob   :3,Czas trwania [min]:136 :7,Kraj Produkcji:USA :8,Rok Produkcji:2019 :9,;0;new;1;;;;;;;;;;;;;
14;1;The Hunger Games: Mockingjay - Part 2;1006,1001,1000;4.06;1;2.97;1;;;;;demo_14;demo_14;;;;;;;;;;;;;1;;0;both;;;;Film;"Katniss Everdeen i przywódcy Dystryktu 13 rozpoczynają wielką ofensywą przeciwko Kapitolowi. Walka toczy się już nie tylko o przetrwanie, ale o przyszłość całego narodu. Katniss wspierana przez Gale’a, Finnicka oraz Peetę planuje zamach na Prezydenta Snowa. Bezwzględni wrogowie i moralne wybory, przed którymi stanie Katniss, będą dla niej większym wyzwaniem niż cokolwiek, co wcześniej przeżyła na arenach Głodowych Igrzysk.
";;;;;the-hunger-games-mockingjay-part-2-2;Produkt dostępny;Zamówienie dozwolone;1;;;1;;;1;Producent:Monolith:0,Reżyseria:  Lawrence Francis   :3,Czas trwania [min]:131 :6,Kraj Produkcji:USA :7,Rok Produkcji:2015 :8,;0;new;1;;;;;;;;;;;;;
15;1;Czarownica 2 (DVD);1006,1001,1000;32.51;1;23.79;1;;;;;demo_15;demo_15;;;;;;;;;;;;;1;;0;both;;;;Film;„Czarownica 2” z Angeliną Jolie w roli głównej to dalszy ciąg historii najsłynniejszego czarnego charakteru Disneya. Po wielu wspólnych szczęśliwych latach relacja Diaboliny i jej córki chrzestnej Aurory zostaje wystawiona na ciężką próbę. Przyczyną jest zbliżający się ślub Aurory. W życiu bohaterek pojawiają się nieoczekiwani sojusznicy i nowe, mroczne siły. Ich miłość okazuje się jednak mocniejsza, dzięki czemu żyją długo i szczęśliwie.;;;;;czarownica-2-dvd;Produkt dostępny;Zamówienie dozwolone;1;;;1;;;1;Producent:Galapagos:0,Reżyseria:  Joachim Rønning  :3,Czas trwania [min]:113 :7,Kraj Produkcji:USA :8,Rok Produkcji:2019 :9,;0;new;1;;;;;;;;;;;;;
16;1;X-Men: Mroczna Phoenix (DVD);1006,1001,1000;24.38;1;17.84;1;;;;;demo_16;demo_16;;;;;;;;;;;;;1;;0;both;;;;Film;Sophie Turner, James McAvoy, Michael Fassbender i Jennifer Lawrence przewodzą gwiazdorskiej obsadzie w tym pasjonującym, widowiskowym filmie stanowiącym swoisty punk kulminacyjny sagi o X-Menach. Podczas kosmicznej misji ratunkowej Jean Grey (Turner) przekształca się w nieskończenie potężną i niebezpieczną MROCZNĄ PHOENIX. Gdy Jane, a właściwie jej alter ego wymyka się spod kontroli, X-Meni muszą się zjednoczyć, by stawić czoła najgroźniejszemu wrogowi - obdarzonemu najbardziej niszczycielską siłą, jakiej świat dotąd nie widział -  jednemu z nich.;;;;;x-men-mroczna-phoenix-dvd;Produkt dostępny;Zamówienie dozwolone;1;;;1;;;1;Producent:Imperial Cinepix:0,Reżyseria:  Simon Kinberg  :3,Czas trwania [min]:109 :7,Kraj Produkcji:USA :8,Rok Produkcji:2019 :9,;0;new;1;;;;;;;;;;;;;
17;1;Urge;1007,1001,1000;4.06;1;2.97;1;;;;;demo_17;demo_17;;;;;;;;;;;;;1;;0;both;;;;Film;Pierce Brosnan („Ocalona”, „November Man”), Danny Masterton („Różowe lata 70.”) i Justin Chatwin („Niewidzialny”, „Wojna światów”) w reżyserskim debiucie Aarona Kaufmana, producenta „Sin City 2: Damulka warta grzechu” i „Maczeta zabija”.Czwórka przyjaciół zamierza spędzić szampański weekend na tropikalnej wyspie. Zabawa nabiera tempa, gdy poznają tajemniczego właściciela klubu nocnego (Pierce Brosnan), który proponuje im spróbowanie nowego, eksperymentalnego narkotyku. Pobudzeni, pozbawieni zahamowań, wcielają w życie swoje najdziksze fantazje. Gdy zafascynowani tajemniczą substancją decydują się powtórzyć dawkę, narkotyk wywołuje nieoczekiwane efekty uboczne, a pobyt na rajskiej wyspie zamienia się w koszmar rodem z domu wariatów.;;;;;urge;Produkt dostępny;Zamówienie dozwolone;1;;;1;;;1;Producent:Monolith:0,Reżyseria:  Aaron Kaufman  :3,Czas trwania [min]:87 :5,Kraj Produkcji:USA :6,Rok Produkcji:2016 :7,;0;new;1;;;;;;;;;;;;;
18;1;A Most Wanted Man;1007,1001,1000;4.06;1;2.97;1;;;;;demo_18;demo_18;;;;;;;;;;;;;1;;0;both;;;;Film;"
Oparty na słynnym bestsellerze Johna le Carré thriller szpiegowski w reżyserii Antona Corbijna, twórcy „Control” oraz „Amerykanina”. Ostatnia wielka rola zdobywcy Oscara Philipa Seymoura Hoffmana („Capote”, „Igrzyska śmierci”). U jego boku: Rachel McAdams („Pamiętnik”), Willem Dafoe („Antychryst”) i Robin Wright („House of Cards”).Od ataku na World Trade Center minęło 10 lat. W Hamburgu, uważanym za jedną z głównych siedzib islamskich terrorystów, pojawia się młody, skrajnie wycieńczony Czeczen, Issa. Jego przyjazd natychmiast wzbudza niepokój kontrwywiadu. Tajemniczy mężczyzna rości sobie bowiem prawo do gigantycznej fortuny zdeponowanej przed laty w prywatnym banku. Wprowokacji przygotowanej przez służby nie tylko agenci będą mieli role do odegrania. Do rozgrywki przystąpi także młoda prawniczka Annabel i leciwy bankier, który jako jedyny ma dostęp do podejrzanego konta. Czy Issa jest ofiarą opresyjnego systemu, czy śmiertelnie groźnym terrorystą, którego kolejny ruch może okazać się tragiczny w skutkach? Rozpoczyna się niebezpieczna wywiadowcza gra, w której nikt nie ufa nikomu...
";;;;;a-most-wanted-man;Produkt dostępny;Zamówienie dozwolone;1;;;1;;;1;Producent:Monolith:0,Reżyseria:  Corbijn Anton   :3,Czas trwania [min]:117 :7,Kraj Produkcji:Niemcy:8,Rok Produkcji:2014 :9,;0;new;1;;;;;;;;;;;;;
19;1;Nice Guys. Równi goście (książka + płyta DVD);1007,1001,1000;4.06;1;2.97;1;;;;;demo_19;demo_19;;;;;;;;;;;;;1;;0;both;;;;Film;Nagrodzony Oscarem® Russell Crowe („Gladiator”) oraz nominowany do Oscara® Ryan Gosling („Szkolny chwyt”) w najnowszym filmie twórcy „Zabójczej broni” oraz „Iron Mana 3”. Pełna akcji komedia o dwóch facetach, których dzieli wszystko oprócz śledztwa w sprawie zaginionej dziewczyny, jakie przyszło im wspólnie prowadzić.Prywatny detektyw Holland March (Ryan Gosling) i gruboskórny mięśniak do wynajęcia Jackson Healy (Russell Crowe) nie pałają do siebie sympatią. Zostają jednak wynajęci do rozwikłania tej samej sprawy zaginionej dziewczyny. Zapewne każdy prowadziłby ją na własną rękę, gdyby obaj nie stali się celem wynajętych morderców. Niechętnie muszą połączyć siły, by rozwiązać sprawę i ocalić życie. Tym bardziej, że wkrótce odkryją, że wdepnęli w większe bagno niż sądzili. Zaginięcie dziewczyny jest jedynie szczytem góry lodowej w sprawie, której nie tknąłby nikt komu życie miłe. Historia staje się więc coraz bardziej dramatyczna, ale mimo zagrożenia Holland i Jackson skupiają się głównie na dogryzaniu sobie nawzajem.;;;;;nice-guys-rowni-goscie-ksiazka-plyta-dvd;Produkt dostępny;Zamówienie dozwolone;1;;;1;;;1;Producent:Monolith:0,Reżyseria:  Black Shane   :3,Czas trwania [min]:111 :7,Rok Produkcji:2016 :8,;0;new;1;;;;;;;;;;;;;
20;1;Wróg numer jeden (DVD) + Książka;1007,1001,1000;4.06;1;2.97;1;;;;;demo_20;demo_20;;;;;;;;;;;;;1;;0;both;;;;Film;Był najbardziej poszukiwanym człowiekiem na świecie. Polowały na niego setki agentów wielu tajnych służb. Wydawało się, że jest nieuchwytny. Osama bin Laden. Jednak dzięki uporowi i zdecydowaniu młodej agentki CIA niemożliwe stało się faktem. Grupa najlepiej wyszkolonych amerykańskich marines wytropiła kryjówkę najgroźniejszego terrorysty wszech czasów. W końcu padł rozkaz: zlikwidować…;;;;;wrog-numer-jeden-dvd-ksiazka;Produkt dostępny;Zamówienie dozwolone;1;;;1;;;1;Producent:Monolith:0,Reżyseria:  Bigelow Kathryn   :3,Czas trwania [min]:150 :7,Kraj Produkcji:USA :8,Rok Produkcji:2012 :9,;0;new;1;;;;;;;;;;;;;
21;1;Latynoski ogier (DVD) + Książka;1008,1001,1000;4.06;1;2.97;1;;;;;demo_21;demo_21;;;;;;;;;;;;;1;;0;both;;;;Film;25 lat temu Maximo (Eugenio Derbez) był playboyem, któremu nie oparła się żadna. Z uwodzenia kobiet uczynił sposób na życie, by ostatecznie poślubić dużo starszą od siebie milionerkę. Żył przy niej jak król. Gdy jednak pewnego dnia odkrył, że ta nie była mu wierna, postanowił zacząć życie od nowa. Bez pieniędzy, pracy i dachu nad głową. Gdy udało mu się odnaleźć dawno niewidzianą siostrę (Salma Hayek), okazało się, że ta samotnie wychowuje syna. Maximo postanawia wprowadzić dorastającego chłopca w tajniki uwodzenia. Czy rola mentora pomoże mu ponownie uwierzyć w siebie i odzyskać dawny urok?;;;;;latynoski-ogier-dvd-ksiazka;Produkt dostępny;Zamówienie dozwolone;1;;;1;;;1;Producent:Monolith:0,Reżyseria:  Ken Marino  :3,Czas trwania [min]:111 :5,Kraj Produkcji:USA :6,Rok Produkcji:2017 :7,;0;new;1;;;;;;;;;;;;;
22;1;Suburbicon (DVD) + Książka;1008,1001,1000;4.06;1;2.97;1;;;;;demo_22;demo_22;;;;;;;;;;;;;1;;0;both;;;;Film;"Matt Damon (Marsjanin), Julianne Moore (""Motyl Still Alice"") i Oscar Isaac (""Co jest grane, Davis?"") w komedii kryminalnej w reżyserii Georga Clooneya, według scenariusza braci Coen.Suburbicon to idealne amerykańskie miasteczko, istna reklama statecznego życia i dobrobytu czyli American Dream w czystej postaci. Jednak nie dla wszystkich. Życie rodziny Lodge'ów obraca w gruzy napad z bronią w ręku, w którym ginie seniorka rodu, ukochana mama nastoletniego Nicky'ego Lodge. Pogrążony w rozpaczy chłopak postanawia pomścić swą ukochaną rodzicielkę.W poszukiwaniu sprawców rozpoczyna śledztwo na własną rękę, w trakcie którego odkryje mroczne rodzinne sekrety, układy, machinacje i animozje, które nie były bez związku ze śmiercią jego matki.";;;;;suburbicon-dvd-ksiazka;Produkt dostępny;Zamówienie dozwolone;1;;;1;;;1;Producent:Monolith:0,Reżyseria:  Clooney George Timothy   :3,Czas trwania [min]:105 :7,Kraj Produkcji:USA :8,Rok Produkcji:2017 :9,;0;new;1;;;;;;;;;;;;;
23;1;Nice Guys. Równi goście (książka + płyta DVD);1008,1001,1000;4.06;1;2.97;1;;;;;demo_23;demo_23;;;;;;;;;;;;;1;;0;both;;;;Film;Nagrodzony Oscarem® Russell Crowe („Gladiator”) oraz nominowany do Oscara® Ryan Gosling („Szkolny chwyt”) w najnowszym filmie twórcy „Zabójczej broni” oraz „Iron Mana 3”. Pełna akcji komedia o dwóch facetach, których dzieli wszystko oprócz śledztwa w sprawie zaginionej dziewczyny, jakie przyszło im wspólnie prowadzić.Prywatny detektyw Holland March (Ryan Gosling) i gruboskórny mięśniak do wynajęcia Jackson Healy (Russell Crowe) nie pałają do siebie sympatią. Zostają jednak wynajęci do rozwikłania tej samej sprawy zaginionej dziewczyny. Zapewne każdy prowadziłby ją na własną rękę, gdyby obaj nie stali się celem wynajętych morderców. Niechętnie muszą połączyć siły, by rozwiązać sprawę i ocalić życie. Tym bardziej, że wkrótce odkryją, że wdepnęli w większe bagno niż sądzili. Zaginięcie dziewczyny jest jedynie szczytem góry lodowej w sprawie, której nie tknąłby nikt komu życie miłe. Historia staje się więc coraz bardziej dramatyczna, ale mimo zagrożenia Holland i Jackson skupiają się głównie na dogryzaniu sobie nawzajem.;;;;;nice-guys-rowni-goscie-ksiazka-plyta-dvd;Produkt dostępny;Zamówienie dozwolone;1;;;1;;;1;Producent:Monolith:0,Reżyseria:  Black Shane   :3,Czas trwania [min]:111 :7,Rok Produkcji:2016 :8,;0;new;1;;;;;;;;;;;;;
24;1;My Big Fat Greek Wedding 2;1008,1001,1000;4.06;1;2.97;1;;;;;demo_24;demo_24;;;;;;;;;;;;;1;;0;both;;;;Film;Po kilkunastu latach od wesela Toula i Ian wciąż bezskutecznie próbują uwolnić się od wszędobylskich greckich krewnych. Gdy czasem zdobędą trochę wolności, zaraz nadarza się okazja, by kochający się rodzinny krąg ponownie zacisnął się jak pętla na szyi. Ich córka Paris wybiera się na studia, a rodzina oczywiście musi zatwierdzić wybór uczelni. Zanosi się na trzęsienie ziemi, bo dziewczyna pragnie opuścić rodzinne Chicago, a co gorsze jej nowy chłopak nawet nie udaje Greka. Jednak prawdziwe tsunami dopiero przed nami. Otóż rodzice Tulli - Maria i Gus - odkrywają, że ich małżeństwo jest nieważne, więc formalnie wciąż są do wzięcia, a to dopiero początek.;;;;;my-big-fat-greek-wedding-2;Produkt dostępny;Zamówienie dozwolone;1;;;1;;;1;Producent:Monolith:0,Reżyseria:  Jones Kirk   :3,Czas trwania [min]:90 :7,Kraj Produkcji:Kanada:8,Rok Produkcji:2016 :9,;0;new;1;;;;;;;;;;;;;
25;1;Zenek (DVD);1009,1001,1000;19.50;1;14.27;1;;;;;demo_25;demo_25;;;;;;;;;;;;;1;;0;both;;;;Film;„Zenek” to oparta na biografii Zenona Martyniuka historia chłopaka z podlaskiej wsi, który realizuje swoje wielkie marzenie: śpiewa i bawi ludzi. Film ukazuje drogę Zenona do wielkiego sukcesu, który osiągnął dzięki uporowi, ciężkiej pracy i wielu wyrzeczeniom. Król disco polo jest tylko jeden!;;;;;zenek-dvd;Produkt dostępny;Zamówienie dozwolone;1;;;1;;;1;Producent:Tvp:0,Reżyseria:  Hryniak Jan   :3,Czas trwania [min]:110 :7,Kraj Produkcji:Polska :8,Rok Produkcji:2020 :9,;0;new;1;;;;;;;;;;;;;
